ID,ENTREVISTA,LOCUTOR,FALA_FIEL,FALA_HIGIENIZADA,NOTA_HUMANA,CONFIANCA_IA_FIEL,CONFIANCA_IA_HIGIENIZADA,ECE_FIEL,ECE_HIGIENIZADA
264,Heloisa_Starling,Heloisa Starling,ééé que tem interesse em ocupar cargos de poder e vê na precipitação do golpe a chance de fazer isso (.) ele faz isso em 37 ele é um integralista né (.) Ahn ele e ele tá no- ele é Capitão em 37 é ele que faz o Plano Cohen que é a- Quando você pensa num golpe de estado eu já vou terminar mas é só para fechar essa ideia ééé Quando você pensa no golpe do Estado pensa na primeira fase que é a conspiração (.) nós vamos conspirar tá contra como é que nós vamos derrubar um governo legalmente constituído e ocupar o poder. a segunda fase é como é que eu crio uma situação de instabilidade institucional de tal maneira que eu possa ééé eu golpista né que nós possamos ocupar o poder ilegalmente. então:: em 37 foi o plano Cohen em que você teria uma Insurreição Comunista no Brasil né (.) ééé em 64 é é a quartelada é a saída das tropas e talvez no oito a gente pensar ééé não sei se vocês vão concordar no 8 de janeiro é o caos. então:: em todas essas três situações você cria um contexto Isso é uma etapa do golpe de estado você cria um contexto para ahn desestabilizar entendeu (?). você cria situação de in- instabilidade né que é o que o Mourão fez e eles (.) ele ele vai ele não consegue o que ele quer né o Castelo Branco vai enquadrar (.) E aí ele faz uma declaração quando ele se dá conta né (.) Ele diz eu em política sou uma vaca fardada tá no Diário dele (..),que tem interesse em ocupar cargos de poder e vê na precipitação do golpe a chance de fazer isso ele faz isso em 37 ele é um integralista né ele e ele tá no- ele é Capitão em 37 é ele que faz o Plano Cohen que é a- Quando você pensa num golpe de estado eu já vou terminar mas é só para fechar essa ideia Quando você pensa no golpe do Estado pensa na primeira fase que é a conspiração nós vamos conspirar tá contra como é que nós vamos derrubar um governo legalmente constituído e ocupar o poder. a segunda fase é como é que eu crio uma situação de instabilidade institucional de tal maneira que eu possa eu golpista né que nós possamos ocupar o poder ilegalmente. então em 37 foi o plano Cohen em que você teria uma Insurreição Comunista no Brasil né em 64 é é a quartelada é a saída das tropas e talvez no oito a gente pensar não sei se vocês vão concordar no 8 de janeiro é o caos. então em todas essas três situações você cria um contexto Isso é uma etapa do golpe de estado você cria um contexto para desestabilizar entendeu (?). você cria situação de in- instabilidade né que é o que o Mourão fez e eles ele ele vai ele não consegue o que ele quer né o Castelo Branco vai enquadrar E aí ele faz uma declaração quando ele se dá conta né Ele diz eu em política sou uma vaca fardada tá no Diário dele,0,31.25,6.2255859375,31.25,6.2255859375
265,Heloisa_Starling,Neif Haddad,boa noite Luísa (.) Boa noite a todos da roda ééé noite queria aproveitar esse gancho da resposta que você deu pro Mário (.) ééé você fala tutela militar né (.) e no- nas entrevistas sobre o livro Você tem falado muito que a gente precisa repensar o papel das Forças Armadas.,boa noite Luísa Boa noite a todos da roda noite queria aproveitar esse gancho da resposta que você deu pro Mário você fala tutela militar né e no- nas entrevistas sobre o livro Você tem falado muito que a gente precisa repensar o papel das Forças Armadas.,65,40.234375,52.734375,24.765625,12.265625
266,Heloisa_Starling,Heloisa Starling,mm hum.,.,90,0.518798828125,0.02002716064453125,89.481201171875,89.97997283935547
267,Heloisa_Starling,Neif Haddad,é curioso porque quando houve logo depois do 8 de janeiro surgiram 1000 propostas ééé de ééé rediscutir o ensino nas escolas militares rediscutir o artigo 142 da Constituição enfim e outras (.) eu queria saber o que que você pensa sobre ééé repensar o papel das da- da- das Forças Armadas (.) o que que você quer dizer com isso (?).,é curioso porque quando houve logo depois do 8 de janeiro surgiram 1000 propostas de rediscutir o ensino nas escolas militares rediscutir o artigo 142 da Constituição enfim e outras eu queria saber o que que você pensa sobre repensar o papel das da- da- das Forças Armadas o que que você quer dizer com isso (?).,55,11.81640625,10.546875,43.18359375,44.453125
268,Heloisa_Starling,Heloisa Starling,eu eu quero dizer talvez a gente isso três três eixos grandes (.) um nós temos que- as forças armadas têm que apresentar o país e o país tem que discutir ééé qual é o plano de defesa tá (.) como é que nós vamos fazer (.) Qual é o nosso projeto para defesa pras fronteiras pra região lá do do do garimpo ilegal para as populações (.) para para para cuidar das Fronteiras (.) ééé qual é o nosso plano e nós vamos discutir esse plano e porque isso enquadra as forças armadas no lugar delas tá. Então:: essa é a primeira Talvez seja o primeiro eixo (.) e isso significaria um debate na sociedade brasileira em vários níveis pensando a questão da defesa e das Forças Armadas que ia nos ajudar a pensar a democracia aquilo que a gente estava falando a cultura democrática né (.) qual é o lugar dela. a outra coisa é que tem que acabar com essa tem que reescrever pelo menos acabar eu tô sendo radical mas ééé o artigo 142 da Constituição (.) esse artigo lá no poder camuflado o Fábio Vitor mostra que ele faz parte de uma transação no sentido entre o General Leônidas que naquele momento faz a interlocução com os constituintes e o então ééé ééé constituinte Fernando Henrique Cardoso. e ele é deliberadamente ambíguo para permitir (.) por isso o poder camuflado (.) para permitir que a- a- você um poder dar as forças armadas o papel de um poder né (.) como- E permitir que um poder possa chamá-las contra outro poder (.) ora elas não são isso né (.) então:: esse seria o segundo ponto.,eu eu quero dizer talvez a gente isso três três eixos grandes um nós temos que- as forças armadas têm que apresentar o país e o país tem que discutir qual é o plano de defesa tá como é que nós vamos fazer Qual é o nosso projeto para defesa pras fronteiras pra região lá do do do garimpo ilegal para as populações para para para cuidar das Fronteiras qual é o nosso plano e nós vamos discutir esse plano e porque isso enquadra as forças armadas no lugar delas tá. Então essa é a primeira Talvez seja o primeiro eixo e isso significaria um debate na sociedade brasileira em vários níveis pensando a questão da defesa e das Forças Armadas que ia nos ajudar a pensar a democracia aquilo que a gente estava falando a cultura democrática né qual é o lugar dela. a outra coisa é que tem que acabar com essa tem que reescrever pelo menos acabar eu tô sendo radical mas o artigo 142 da Constituição esse artigo lá no poder camuflado o Fábio Vitor mostra que ele faz parte de uma transação no sentido entre o General Leônidas que naquele momento faz a interlocução com os constituintes e o então constituinte Fernando Henrique Cardoso. e ele é deliberadamente ambíguo para permitir por isso o poder camuflado para permitir que a- a- você um poder dar as forças armadas o papel de um poder né como- E permitir que um poder possa chamá-las contra outro poder ora elas não são isso né então esse seria o segundo ponto.,0,37.109375,29.1015625,37.109375,29.1015625
269,Heloisa_Starling,Vera Magalhães,Supremo tá debatendo isso exatamente agora né já são cinco votos a favor dessa interpretação que Vot- hoje é de que não existe esse poder moderador para as Forças Armadas né (?).,Supremo tá debatendo isso exatamente agora né já são cinco votos a favor dessa interpretação que Vot- hoje é de que não existe esse poder moderador para as Forças Armadas né (?).,90,61.71875,61.71875,28.28125,28.28125
270,Heloisa_Starling,Heloisa Starling,é eu não não diria nem que é moder- quer dizer não vou falar isso do supremo deixa ser moderador mas essa coisa da tutela é-.,é eu não não diria nem que é moder- quer dizer não vou falar isso do supremo deixa ser moderador mas essa coisa da tutela é-.,90,18.06640625,18.06640625,71.93359375,71.93359375
271,Heloisa_Starling,Vera Magalhães,pois é.,pois é.,100,5.2978515625,5.2978515625,94.7021484375,94.7021484375
272,Heloisa_Starling,Heloisa Starling,mas eu eu diria que é um poder Tutelar mais do que o moderador porque o moderador no império tá acima né (.) Ele é o- Mas enfim a explicação É essa mesmo. e a outra é realmente como é que nós vamos enquadrar o ensino das escolas militares dentro do ensino que o povo brasileiro que as escolas públicas seguem entendeu (?) porque eles fazem isso à parte (.) isso tem- isso traz um problema muito grande né. Eu vi uma matéria de Um Jornalista ontem anteontem o Guilherme Amado em que ele vai mostrar (.) um outro jornalista também me mostrou o Ruben- Rubens Valente Rubens Valente (.) é (.) Ele me mostrou como como como é que você cria toda uma uma história ideológica como é que você cria uma uma uma história do golpe como uma uma revolução democrática que salvou o Brasil do comunismo e em apostilas né. então:: eu acho que essas três coisas a gente precisa pensar urgente não podemos perder essa oportunidade.,mas eu eu diria que é um poder Tutelar mais do que o moderador porque o moderador no império tá acima né Ele é o- Mas enfim a explicação É essa mesmo. e a outra é realmente como é que nós vamos enquadrar o ensino das escolas militares dentro do ensino que o povo brasileiro que as escolas públicas seguem entendeu (?) porque eles fazem isso à parte isso tem- isso traz um problema muito grande né. Eu vi uma matéria de Um Jornalista ontem anteontem o Guilherme Amado em que ele vai mostrar um outro jornalista também me mostrou o Ruben- Rubens Valente Rubens Valente é Ele me mostrou como como como é que você cria toda uma uma história ideológica como é que você cria uma uma uma história do golpe como uma uma revolução democrática que salvou o Brasil do comunismo e em apostilas né. então eu acho que essas três coisas a gente precisa pensar urgente não podemos perder essa oportunidade.,40,31.4453125,34.1796875,8.5546875,5.8203125
273,Heloisa_Starling,Vera Magalhães,vou pedir licença pr- Paula Miralha porque eu chamo ela depois do intervalo (.) a gente vai rapidinho para intervalo e volta já já e eu abro com El- (..) educação que transforma Bradesco nós estamos de volta com já vivoa que hoje entrevista é historiadora Eloí starlin (.) Quem pergunta para ela agora é a Paula Miralha.,vou pedir licença pr- Paula Miralha porque eu chamo ela depois do intervalo a gente vai rapidinho para intervalo e volta já já e eu abro com El- educação que transforma Bradesco nós estamos de volta com já vivoa que hoje entrevista é historiadora Eloí starlin Quem pergunta para ela agora é a Paula Miralha.,60,26.5625,22.0703125,33.4375,37.9296875
274,Heloisa_Starling,Paula Miraglia,Boa noite Elô (.) ééé eu queria retomar o- a pergunta da Vera quando ela abriu o programa falar um pouco dessa decisão do presidente Lula ééé quando ele fala que ele tá mais interessado em tocar o país pra frente e estabelece uma espécie de veto né a- a movimentações oficiais em relação ao golpe (.) o que que você acha tá por trás disso como motivação (?). então:: é uma deferência ao exército (?) é um receio barra medo (?) é um cálculo político (?) alguma outra coisa (?) o que que tá por trás dessa decisão (?). E eu queria também te perguntar assim como que você avalia as consequências ééé disso ééé do ponto de vista político Quais são as consequências políticas e quais são as consequências na relação com a sociedade civil ééé organizada no Brasil que sempre foi né tradicionalmente um ator tão importante salvaguardando a democracia brasileira (?).,Boa noite Elô eu queria retomar o- a pergunta da Vera quando ela abriu o programa falar um pouco dessa decisão do presidente Lula quando ele fala que ele tá mais interessado em tocar o país pra frente e estabelece uma espécie de veto né a- a movimentações oficiais em relação ao golpe o que que você acha tá por trás disso como motivação (?). então é uma deferência ao exército (?) é um receio barra medo (?) é um cálculo político (?) alguma outra coisa (?) o que que tá por trás dessa decisão (?). E eu queria também te perguntar assim como que você avalia as consequências disso do ponto de vista político Quais são as consequências políticas e quais são as consequências na relação com a sociedade civil organizada no Brasil que sempre foi né tradicionalmente um ator tão importante salvaguardando a democracia brasileira (?).,40,24.12109375,16.30859375,15.87890625,23.69140625
275,Heloisa_Starling,Heloisa Starling,é (.) eu entendo que a sociedade civil tem obrigação de independente do Presidente da República do Estado ela tem que se mobilizar (.) as Universidades ééé para construir né os- a história tá. agora ééé no caso do do presidente Talvez o que o que tem parecido é- o historiador é bom para prever o passado né (.) então:: o que tem parecido é nós pensarmos que de fato é um- teve ali uma uma negociação. e isso é ruim para a democracia porque significa dar à instituição militar às Forças Armadas um patamar (.) ela não negocia com o Presidente da República né. ééé a estratégia pode ser essa quer dizer nós podemos pensar que politicamente ele tem uma avaliação a de que ééé nós nós nós não sabemos o tamanho da destruição que foi produzida dentro das forças armadas o tamanho do bolsonarismo (.) e talvez nesse momento ele tenha agido por- politicamente com esse objetivo quer dizer vamos (.) mas faltou se dar conta né de que ao fazer isso tem consequências pra democracia como eu disse você pensar a questão ééé da cultura democrática e pensar a importância que é o estado brasileiro ééé reconhecer chamar para si também né a república dizer olha aqui é um lugar de memória isso aqui é importante é pensar esse evento é importante. ééé e a terceira coisa é nós pensarmos também o seguinte (.) ao fazer isso nós estamos deixando de entender o que provavelmente é a matriz dessa situação ahn da situação Tutelar das Forças Armadas mas também dessa situação de golpe que nós ééé vivemos no 8 de janeiro ou naquele momento em que eles iam botar um caminhão explodindo no aeroporto de Brasília né na na na na na ao lado do aeroporto um camião com querosene assim um negócio apavorante aí o bolsonaro poderia entrar com o estado de emergência entendeu (?). então:: eu posso pensar que politicamente ele Talvez ele tenha agido dessa forma (.) pra democracia não não foi uma boa solução por essas razões.,é eu entendo que a sociedade civil tem obrigação de independente do Presidente da República do Estado ela tem que se mobilizar as Universidades para construir né os- a história tá. agora no caso do do presidente Talvez o que o que tem parecido é- o historiador é bom para prever o passado né então o que tem parecido é nós pensarmos que de fato é um- teve ali uma uma negociação. e isso é ruim para a democracia porque significa dar à instituição militar às Forças Armadas um patamar ela não negocia com o Presidente da República né. a estratégia pode ser essa quer dizer nós podemos pensar que politicamente ele tem uma avaliação a de que nós nós nós não sabemos o tamanho da destruição que foi produzida dentro das forças armadas o tamanho do bolsonarismo e talvez nesse momento ele tenha agido por- politicamente com esse objetivo quer dizer vamos mas faltou se dar conta né de que ao fazer isso tem consequências pra democracia como eu disse você pensar a questão da cultura democrática e pensar a importância que é o estado brasileiro reconhecer chamar para si também né a república dizer olha aqui é um lugar de memória isso aqui é importante é pensar esse evento é importante. e a terceira coisa é nós pensarmos também o seguinte ao fazer isso nós estamos deixando de entender o que provavelmente é a matriz dessa situação da situação Tutelar das Forças Armadas mas também dessa situação de golpe que nós vivemos no 8 de janeiro ou naquele momento em que eles iam botar um caminhão explodindo no aeroporto de Brasília né na na na na na ao lado do aeroporto um camião com querosene assim um negócio apavorante aí o bolsonaro poderia entrar com o estado de emergência entendeu (?). então eu posso pensar que politicamente ele Talvez ele tenha agido dessa forma pra democracia não não foi uma boa solução por essas razões.,0,72.265625,69.53125,72.265625,69.53125
276,Heloisa_Starling,Vera Magalhães,Tatiana.,Tatiana.,100,4.7119140625,4.7119140625,95.2880859375,95.2880859375
277,Heloisa_Starling,Tatiana Vasconcelos,Eloí (.) logo no começo do livro você descreve as características daquele Golpe de 64 (.) alguns ééé aplicáveis em outros momentos da nossa história mas basicamente você conta dos ingredientes que formam configuram um golpe de estado. eu queria que você Contasse Quais são esses ingredientes aplicáveis ao golpe de 64 (.) E se eles se aplicam à tentativa que a gente teve recentemente com bolsonaro e seus apoiadores inclusive com integrantes das Forças Armadas (?).,Eloí logo no começo do livro você descreve as características daquele Golpe de 64 alguns aplicáveis em outros momentos da nossa história mas basicamente você conta dos ingredientes que formam configuram um golpe de estado. eu queria que você Contasse Quais são esses ingredientes aplicáveis ao golpe de 64 E se eles se aplicam à tentativa que a gente teve recentemente com bolsonaro e seus apoiadores inclusive com integrantes das Forças Armadas (?).,80,49.609375,49.609375,30.390625,30.390625
278,Heloisa_Starling,Heloisa Starling,eu acho que sim (.) Acho que as duas coisas (.) quando a gente pensa no nesse no golpe de estado moderno né ééé Digamos que nós podemos pensar em três camadas em três etapas (.) três quatro etapas tá (.) você- nós temos que conspirar você precisa ter a conspiração é que ahn vai ser grande no período 64 e que no caso de hoje Nós não sabemos a extensão dessa conspiração Como Nós não sabemos a extensão da destruição ahn dentro das Forças Armadas produzidas pelo bolsonarismo né. a segunda etapa é aquilo que eu tava dizendo que é como é que eu crio uma situação de instabilidade ééé institucional de tal maneira que eu- que eu abro a porta para a deposição do Presidente da República. Então:: vamos supor provavelmente ééé no caso do caminhão se se explodisse né você- o bolsonaro teria o argumento para repetir aquilo que Vargas faz em 37 o estado de emergência né (.) e o estado de emergência salvo melhor juízo ele não precisa nem ele não precisa do congresso é mais mais fácil né ééé Ou estado de defesa né. E aí com isso ééé você teria essa essa fase (.) o bolsonaro sempre nas tentativas dele de desestabilização ele tenta fazer um o que a gente chamaria do pronunciamento (.) a sociedade uma fatia da sociedade vai para a rua se pronuncia ééé intervém nós queremos militares queremos a- a intervenção militar ééé ela se coloca no- na posição de que ela representa o povo brasileiro e aí as forças armadas atendem ao pedido. então:: aquela coisa de você ir pra porta do quartel ééé chamar as as forças armadas ou ir pra Rua dizer ééé rezar pr- pneu é é e ir pra rua no no Sete de Setembro isso aí não é a quartelada do Mourão é a- é o pronunciamento (.) mas o efeito é o mesmo (.) eu vou criar uma situação de instabilidade. a terceira etapa é como é que eu ocupo o poder (.) eu deponho o presidente quem vai ocupar o poder como que ele vai ser ocupado que aonde o bolsonaro felizmente não chegou mas que em 64 você tem a primeira racha né A primeira divisão dentro das forças armadas entre duas facções uma radical liderada pelo Costa e Silva ééé que quer aumentar a repressão e a outra com o projeto ééé de Brasil que é da escola superior de guerra que é um projeto que nós podemos concordar ou discordar mas tinha um projeto de como que eles iam ocupar o poder. e a última etapa é a consolidação do Poder no caso de 64 21 anos né (.) Então:: essas seriam as etapas pr- pra gente pensar como que que funciona né o-.,eu acho que sim Acho que as duas coisas quando a gente pensa no nesse no golpe de estado moderno né Digamos que nós podemos pensar em três camadas em três etapas três quatro etapas tá você- nós temos que conspirar você precisa ter a conspiração é que vai ser grande no período 64 e que no caso de hoje Nós não sabemos a extensão dessa conspiração Como Nós não sabemos a extensão da destruição dentro das Forças Armadas produzidas pelo bolsonarismo né. a segunda etapa é aquilo que eu tava dizendo que é como é que eu crio uma situação de instabilidade institucional de tal maneira que eu- que eu abro a porta para a deposição do Presidente da República. Então vamos supor provavelmente no caso do caminhão se se explodisse né você- o bolsonaro teria o argumento para repetir aquilo que Vargas faz em 37 o estado de emergência né e o estado de emergência salvo melhor juízo ele não precisa nem ele não precisa do congresso é mais mais fácil né Ou estado de defesa né. E aí com isso você teria essa essa fase o bolsonaro sempre nas tentativas dele de desestabilização ele tenta fazer um o que a gente chamaria do pronunciamento a sociedade uma fatia da sociedade vai para a rua se pronuncia intervém nós queremos militares queremos a- a intervenção militar ela se coloca no- na posição de que ela representa o povo brasileiro e aí as forças armadas atendem ao pedido. então aquela coisa de você ir pra porta do quartel chamar as as forças armadas ou ir pra Rua dizer rezar pr- pneu é é e ir pra rua no no Sete de Setembro isso aí não é a quartelada do Mourão é a- é o pronunciamento mas o efeito é o mesmo eu vou criar uma situação de instabilidade. a terceira etapa é como é que eu ocupo o poder eu deponho o presidente quem vai ocupar o poder como que ele vai ser ocupado que aonde o bolsonaro felizmente não chegou mas que em 64 você tem a primeira racha né A primeira divisão dentro das forças armadas entre duas facções uma radical liderada pelo Costa e Silva que quer aumentar a repressão e a outra com o projeto de Brasil que é da escola superior de guerra que é um projeto que nós podemos concordar ou discordar mas tinha um projeto de como que eles iam ocupar o poder. e a última etapa é a consolidação do Poder no caso de 64 21 anos né Então essas seriam as etapas pr- pra gente pensar como que que funciona né o-.,0,55.078125,26.171875,55.078125,26.171875
279,Heloisa_Starling,Vera Magalhães,o o governo não fez nada oficial (.) Mas enfim a imprensa tá cumprindo um papel nesses 60 anos do golpe trazendo à luz muitos documentos novos né e de importante aí ééé muito importantes pra gente entender o contexto entender alguns personagens. um deles é o podcast da CBN com alguns áudios inéditos que embasaram os livros do Hélio Gaspar- Estadão também soltou uma série de depoimentos que Manteve no seu arquivo com o compromisso de só soltar depois que todos os depoentes tivessem morrido. e nesses documentos todos fica evidente algo que também tá no seu livro que é a forte ééé participação apoio ali dos empresários ao golpe de 64 grandes empresários. ééé você acha que tem uma analogia possível com o apoio de setores do agronegócio do Comércio ou mesmo da indústria agora em 2022 23 ou lá era uma coisa muito mais organizada institucionalizada e levada a cabo realmente pela classe Empresarial (?).,o o governo não fez nada oficial Mas enfim a imprensa tá cumprindo um papel nesses 60 anos do golpe trazendo à luz muitos documentos novos né e de importante aí muito importantes pra gente entender o contexto entender alguns personagens. um deles é o podcast da CBN com alguns áudios inéditos que embasaram os livros do Hélio Gaspar- Estadão também soltou uma série de depoimentos que Manteve no seu arquivo com o compromisso de só soltar depois que todos os depoentes tivessem morrido. e nesses documentos todos fica evidente algo que também tá no seu livro que é a forte participação apoio ali dos empresários ao golpe de 64 grandes empresários. você acha que tem uma analogia possível com o apoio de setores do agronegócio do Comércio ou mesmo da indústria agora em 2022 23 ou lá era uma coisa muito mais organizada institucionalizada e levada a cabo realmente pela classe Empresarial (?).,70,52.34375,49.21875,17.65625,20.78125
