ID,ENTREVISTA,LOCUTOR,FALA_FIEL,FALA_HIGIENIZADA,NOTA_HUMANA,CONFIANCA_IA_FIEL,CONFIANCA_IA_HIGIENIZADA,ECE_FIEL,ECE_HIGIENIZADA
1,Marco Aurelio,Augusto Nunes,o retorno do ministro marco Aurélio Melo ao centro do Roda Viva onde esteve em outubro passado (.) é uma das inúmeras evidências de que o Supremo Tribunal Federal foi levado pela circunstâncias a desempenhar um papel fundamental na busca de soluções para profunda conjunção de crises que aflige o Brasil. o impeachment previsto na Constituição pode ser chamado de Golpe (?) é legítimo e legal que acontece nas negociações envolvendo executivo e o legislativo (?) o ex-presidente Lula na mira da lava jato pode ser transformado em chefe da casa civil de Dilma Rousseff (?) o foro privilegiado deve continuar existindo (?). Estas são algumas dúvidas que pretendemos esclarecer com entrevistado de hoje do Roda Viva (.) o ministro do STF Marco Aurélio Mello (..) Boa noite (.) estamos ao vivo em todo o país pela TV Cultura pelas emissoras afiliadas e pelo nosso canal no YouTube. hoje a nossa bancada de entrevistadores é formada por José neumani editorialista do Jornal O Estado de São Paulo e comentarista da TV Gazeta e da Rádio Estadão (.) o André Guilherme Vieira repórter do Jornal Valor Econômico (.) Gisele Vitória colunista da revista Isto É (.) Maria Cristina frias Editora da coluna Mercado aberto do jornal Folha de São Paulo (.) e Murilo Ramos colunista da revista Época. contamos também como sempre com os desenhos feitos em tempo real pelo nosso cartunista Paulo Caruso. agora você pode acompanhar o Roda Viva em seu celular e também rever entrevistas anteriores (.) É só baixar o programa na loja de aplicativos do seu aparelho (..) Ministro Marco Antônio Melo (.) Muito obrigado muito obrigado e como se eu não tivesse entrevistado o senhor várias vezes nos conhecemos (.) obrigado pela aceitação do convite. o senhor esteve aqui em outubro como sempre concedeu uma entrevista excelente sobretudo que o senhor é um homem Franco (.) É por isso também como explicar a abertura que quisermos o senhor aqui de volta (..) eu começo perguntando o seguinte (.) no episódio da- da divulgação das conversas gravadas pela Polícia Federal o senhor o que é que incomodou mais o senhor (.) a divulgação em si das gravações ou o conteúdo das conversas gravadas pela lava jato (?).,o retorno do ministro marco Aurélio Melo ao centro do Roda Viva onde esteve em outubro passado é uma das inúmeras evidências de que o Supremo Tribunal Federal foi levado pela circunstâncias a desempenhar um papel fundamental na busca de soluções para profunda conjunção de crises que aflige o Brasil. o impeachment previsto na Constituição pode ser chamado de Golpe (?) é legítimo e legal que acontece nas negociações envolvendo executivo e o legislativo (?) o ex-presidente Lula na mira da lava jato pode ser transformado em chefe da casa civil de Dilma Rousseff (?) o foro privilegiado deve continuar existindo (?). Estas são algumas dúvidas que pretendemos esclarecer com entrevistado de hoje do Roda Viva o ministro do STF Marco Aurélio Mello Boa noite estamos ao vivo em todo o país pela TV Cultura pelas emissoras afiliadas e pelo nosso canal no YouTube. hoje a nossa bancada de entrevistadores é formada por José neumani editorialista do Jornal O Estado de São Paulo e comentarista da TV Gazeta e da Rádio Estadão o André Guilherme Vieira repórter do Jornal Valor Econômico Gisele Vitória colunista da revista Isto É Maria Cristina frias Editora da coluna Mercado aberto do jornal Folha de São Paulo e Murilo Ramos colunista da revista Época. contamos também como sempre com os desenhos feitos em tempo real pelo nosso cartunista Paulo Caruso. agora você pode acompanhar o Roda Viva em seu celular e também rever entrevistas anteriores É só baixar o programa na loja de aplicativos do seu aparelho Ministro Marco Antônio Melo Muito obrigado muito obrigado e como se eu não tivesse entrevistado o senhor várias vezes nos conhecemos obrigado pela aceitação do convite. o senhor esteve aqui em outubro como sempre concedeu uma entrevista excelente sobretudo que o senhor é um homem Franco É por isso também como explicar a abertura que quisermos o senhor aqui de volta eu começo perguntando o seguinte no episódio da- da divulgação das conversas gravadas pela Polícia Federal o senhor o que é que incomodou mais o senhor a divulgação em si das gravações ou o conteúdo das conversas gravadas pela lava jato (?).,0,43.359375,29.296875,43.359375,29.296875
2,Marco Aurelio,Marco Aurélio Mello,ambas as coisas (.) a divulgação é condenar viu a todos os títulos já que nós temos uma lei que impõe o sigilo e houve a divulgação do objeto da interceptação (.) é algo super desagradável para dizer o mínimo.,ambas as coisas a divulgação é condenar viu a todos os títulos já que nós temos uma lei que impõe o sigilo e houve a divulgação do objeto da interceptação é algo super desagradável para dizer o mínimo.,90,34.5703125,46.484375,55.4296875,43.515625
3,Marco Aurelio,Augusto Nunes,a divulgação seria o que (?) uma infração processual (?) erro processual (?) eu pergunto primeiro isso para saber se uma irregularidade desse tipo é mais importante que o crime que ela documento (?).,a divulgação seria o que (?) uma infração processual (?) erro processual (?) eu pergunto primeiro isso para saber se uma irregularidade desse tipo é mais importante que o crime que ela documento (?).,100,34.375,34.375,65.625,65.625
4,Marco Aurelio,Marco Aurélio Mello,cometida a divulgação pelo cidadão comum é um crime e a pena prevista para esse crime na própria lei de Regência (.) agora fo- por um magistrado por um juiz da causa evidentemente se tem aí um erro de procedimento e que deságua em uma sanção no campo administrativo (..).,cometida a divulgação pelo cidadão comum é um crime e a pena prevista para esse crime na própria lei de Regência agora fo- por um magistrado por um juiz da causa evidentemente se tem aí um erro de procedimento e que deságua em uma sanção no campo administrativo .,75,29.1015625,29.1015625,45.8984375,45.8984375
5,Marco Aurelio,Maria Cristina Frias,Maria Cristina diferentes grupos tem proposto eleições Gerais ou eleições para Presidente seja por referendo seja por emenda constitucional eleições agora (.) essa ideia de eleições agora é constitucional (?).,Maria Cristina diferentes grupos tem proposto eleições Gerais ou eleições para Presidente seja por referendo seja por emenda constitucional eleições agora essa ideia de eleições agora é constitucional (?).,95,46.484375,52.734375,48.515625,42.265625
6,Marco Aurelio,Marco Aurélio Mello,de início eleições Gerais aí pressuporia uma renúncia coletiva (.) renúncia não só daqueles que ocupam cargos no executivo como também no legislativo e isso é o tópico isso é algo irreal considerada cultura brasileira. nós não temos como implementar uma Emenda para alterar um processo em curso e ter esse- portanto as eleições Gerais essa emenda de início e aí o conceito é um conceito técnico ela se mostraria contraria aos Titãs constitucionais (..).,de início eleições Gerais aí pressuporia uma renúncia coletiva renúncia não só daqueles que ocupam cargos no executivo como também no legislativo e isso é o tópico isso é algo irreal considerada cultura brasileira. nós não temos como implementar uma Emenda para alterar um processo em curso e ter esse- portanto as eleições Gerais essa emenda de início e aí o conceito é um conceito técnico ela se mostraria contraria aos Titãs constitucionais .,75,43.1640625,49.4140625,31.8359375,25.5859375
7,Marco Aurelio,José Nêumanne,Boa noite Ministro (.) Boa noite Ministro (.) eu sou um cidadão direito mas se eu fosse um bandido eu adorarei a t- ter foram privilegiado porque o Supremo Tribunal Federal é muito- eu tenho provas históricas por exemplo Eduardo Azeredo cometeu o mensalão Mineiro e passou anos impune sobre a égide do supremo que nunca julgava. na hora que ele cometeu a estupidez de renunciar ao forro privilegiado porque ia ser pego o juiz pegou e meteu-lhe 20 anos de cana. o senhor tá se queixando aí do Sérgio moro no- Sérgio moro condenou 67 Réus em 17 processos enquanto isso vocês estão lá (.) Renan Calheiros 9 processos o Eduardo Cunha seis processos ninguém é julgado. então o Lulinha que é um grande malandro tá lá sobre a sombra da impunidade de vocês e vocês brincam e o julgamento vai (.) a pergunta é a seguinte (.) é um grande negócio ter furo privilegiado no Brasil (?).,Boa noite Ministro Boa noite Ministro eu sou um cidadão direito mas se eu fosse um bandido eu adorarei a t- ter foram privilegiado porque o Supremo Tribunal Federal é muito- eu tenho provas históricas por exemplo Eduardo Azeredo cometeu o mensalão Mineiro e passou anos impune sobre a égide do supremo que nunca julgava. na hora que ele cometeu a estupidez de renunciar ao forro privilegiado porque ia ser pego o juiz pegou e meteu-lhe 20 anos de cana. o senhor tá se queixando aí do Sérgio moro no- Sérgio moro condenou 67 Réus em 17 processos enquanto isso vocês estão lá Renan Calheiros 9 processos o Eduardo Cunha seis processos ninguém é julgado. então o Lulinha que é um grande malandro tá lá sobre a sombra da impunidade de vocês e vocês brincam e o julgamento vai a pergunta é a seguinte é um grande negócio ter furo privilegiado no Brasil (?).,35,28.125,19.43359375,6.875,15.56640625
8,Marco Aurelio,Marco Aurélio Mello,em primeiro lugar eu não critiquei o colega Sérgio moro (.) não não De forma algum meu- então foi mal compreendido como tenho sido mal compreendido em certos episódios. eu fiz uma constatação ou seja houve uma divulgação frontalmente contrária a lei a minha colocação é uma colocação científica. em segundo lugar eu não posso concordar de forma alguma enquadramento com enquadramento do supremo como um órgão benevolente (.) nós temos um exemplo recente que é o julgamento do processo que ficou conhecido como mensalão. impusemos todas Nações inclusive perdoados com pena perdoada só os que não tem pessoas que não tem problema (.) não houve um indulto Natalino e nós temos que cum- essa responsabilidade para o Supremo. o Supremo é a última trincheira da Cidadania e a atuação dele é uma atuação vinculada vin- vinculada constituição federal e fora disso não há salvação Como já dizia Ruy Barbosa (..).,em primeiro lugar eu não critiquei o colega Sérgio moro não não De forma algum meu- então foi mal compreendido como tenho sido mal compreendido em certos episódios. eu fiz uma constatação ou seja houve uma divulgação frontalmente contrária a lei a minha colocação é uma colocação científica. em segundo lugar eu não posso concordar de forma alguma enquadramento com enquadramento do supremo como um órgão benevolente nós temos um exemplo recente que é o julgamento do processo que ficou conhecido como mensalão. impusemos todas Nações inclusive perdoados com pena perdoada só os que não tem pessoas que não tem problema não houve um indulto Natalino e nós temos que cum- essa responsabilidade para o Supremo. o Supremo é a última trincheira da Cidadania e a atuação dele é uma atuação vinculada vin- vinculada constituição federal e fora disso não há salvação Como já dizia Ruy Barbosa .,45,72.265625,66.796875,27.265625,21.796875
9,Marco Aurelio,José Nêumanne,Ministro mas sobre mim é só- só um minutinho pra gente não perder a hora dele o senhor não respondeu sobre o foro privilegiado se é um bom negócio (.).,Ministro mas sobre mim é só- só um minutinho pra gente não perder a hora dele o senhor não respondeu sobre o foro privilegiado se é um bom negócio .,95,26.5625,26.5625,68.4375,68.4375
10,Marco Aurelio,Marco Aurélio Mello,Todos sabem a minha concepção sobre a prerrogativa de foro (.) O Privilégio se é que é privilégio porque a queima de etapas tem se penada unica mediante o pronunciamento do supremo de ser julgado pelo Supremo. eu sou de concepção Democrata eu penso que todo e qualquer cidadão independentemente do cargo Porque nós não julgamos o cargo nós julgamos o cidadão deve ser julgado pelo juiz de primeira instância como ocorre por exemplo é a nossa- o nosso judiciário foi criado a imagem americana principalmente a suprema corte nos Estados Unidos da América (..).,Todos sabem a minha concepção sobre a prerrogativa de foro O Privilégio se é que é privilégio porque a queima de etapas tem se penada unica mediante o pronunciamento do supremo de ser julgado pelo Supremo. eu sou de concepção Democrata eu penso que todo e qualquer cidadão independentemente do cargo Porque nós não julgamos o cargo nós julgamos o cidadão deve ser julgado pelo juiz de primeira instância como ocorre por exemplo é a nossa- o nosso judiciário foi criado a imagem americana principalmente a suprema corte nos Estados Unidos da América .,75,19.921875,21.97265625,55.078125,53.02734375
11,Marco Aurelio,Gisele Vitória,Gisele vittar Boa noite Ministro (.) José na semana passada declarou essa frase se não houver fato jurídico que respalde o processo de impedimento esse processo se enquadra no figurino legal e transparece como golpe. eu primeiro queria perguntar se essa impressão de golpe que o senhor se refere ela pode agravar ainda mais a crise do que solucionar (?) Por que que o sor- vê esse cenário (?). e pegando uma caroninha também aqui pensando aqui que o rito de impeachment ele é muito mais de natureza política do que jurídica é realmente Talvez não haja elemento jurídicos para uma ação criminal mas pensando assim eu pergunto para o senhor se o senhor acha que o impeachment do presidente do ex-presidente Collor transparecer um golpe já que ele foi absolvido no Supremo depois (?) a resposta última pergunta (.).,Gisele vittar Boa noite Ministro José na semana passada declarou essa frase se não houver fato jurídico que respalde o processo de impedimento esse processo se enquadra no figurino legal e transparece como golpe. eu primeiro queria perguntar se essa impressão de golpe que o senhor se refere ela pode agravar ainda mais a crise do que solucionar (?) Por que que o sor- vê esse cenário (?). e pegando uma caroninha também aqui pensando aqui que o rito de impeachment ele é muito mais de natureza política do que jurídica é realmente Talvez não haja elemento jurídicos para uma ação criminal mas pensando assim eu pergunto para o senhor se o senhor acha que o impeachment do presidente do ex-presidente Collor transparecer um golpe já que ele foi absolvido no Supremo depois (?) a resposta última pergunta .,70,67.1875,58.59375,2.8125,11.40625
12,Marco Aurelio,Marco Aurélio Mello,houve uma decisão houve uma decisão do congresso nacional quanto ao impedimento do ex-presidente Fernando Afonso Collor de Melo e eu tenho que pressupor que essa decisão foi uma decisão correta segundo figurino constitucional figurino legal. agora eu sou muito mal compreendido parece que eu não falo bem o português não o vernáculo porque a chance de o senhor se explicar exatamente (.) eu fui questionado por jornalistas eu estou sempre pronto a falar os jornalistas quanto a uma frase da presidente Dilma que ela estaria acelerar com uma Severa até os dias atuais que o impedimento o processo de impedimento que não deixa de ser um processo crime ele é um golpe. o que eu- foi o que foi que eu disse então (?) eu disse olha haverá procedência do que acelerado pela chefe do executivo Nacional se não se tiver um fato jurídico ou seja um crime de responsabilidade. eu não admitiu o processo que está em andamento que eu inclusive não conheço o te- esse processo as imputações em si eu não parei para examinar porque recebo por semana no gabinete uma média de 100 processos novos né (.) Eu não conheço e não me atreveria a antecipar Essa visão de que estaríamos diante de um golpe. o que o- asseverei e asseveram neste momento aos cidadãos em geral é que se não houver um fato jurídico já que o processo ele tem uma mesclagem do político com jurídico se não houver Aí sim se terá um golpe político (..) Augusto Nunes eu não examinei não parei para examinar e eu não anteceparia um convencimento sobre essa matéria sabendo que ela está submetida ao congresso nacional (..).,houve uma decisão houve uma decisão do congresso nacional quanto ao impedimento do ex-presidente Fernando Afonso Collor de Melo e eu tenho que pressupor que essa decisão foi uma decisão correta segundo figurino constitucional figurino legal. agora eu sou muito mal compreendido parece que eu não falo bem o português não o vernáculo porque a chance de o senhor se explicar exatamente eu fui questionado por jornalistas eu estou sempre pronto a falar os jornalistas quanto a uma frase da presidente Dilma que ela estaria acelerar com uma Severa até os dias atuais que o impedimento o processo de impedimento que não deixa de ser um processo crime ele é um golpe. o que eu- foi o que foi que eu disse então (?) eu disse olha haverá procedência do que acelerado pela chefe do executivo Nacional se não se tiver um fato jurídico ou seja um crime de responsabilidade. eu não admitiu o processo que está em andamento que eu inclusive não conheço o te- esse processo as imputações em si eu não parei para examinar porque recebo por semana no gabinete uma média de 100 processos novos né Eu não conheço e não me atreveria a antecipar Essa visão de que estaríamos diante de um golpe. o que o- asseverei e asseveram neste momento aos cidadãos em geral é que se não houver um fato jurídico já que o processo ele tem uma mesclagem do político com jurídico se não houver Aí sim se terá um golpe político Augusto Nunes eu não examinei não parei para examinar e eu não anteceparia um convencimento sobre essa matéria sabendo que ela está submetida ao congresso nacional .,30,28.7109375,36.71875,1.2890625,6.71875
13,Marco Aurelio,Augusto Nunes,relações com o senhor acaba de mencionar que foram divulgadas pela- autorizadas as divulgação pelo pelo juiz Sérgio moro a um trecho em que o presidente o ex-presidente Lula diz que o Supremo Tribunal Federal tá a covardado (.) o senhor concorda com essa afirmação (?) os ministros do Supremo Tribunal Federal eles terão condições de bem julgar isso diante da pressão das ruas que tá bastante consideramos (?).,relações com o senhor acaba de mencionar que foram divulgadas pela- autorizadas as divulgação pelo pelo juiz Sérgio moro a um trecho em que o presidente o ex-presidente Lula diz que o Supremo Tribunal Federal tá a covardado o senhor concorda com essa afirmação (?) os ministros do Supremo Tribunal Federal eles terão condições de bem julgar isso diante da pressão das ruas que tá bastante consideramos (?).,75,26.3671875,40.234375,48.6328125,34.765625
14,Marco Aurelio,Marco Aurélio Mello,porque a cadeira ocupada por um juízo Supremo é uma cadeira vitalícia d- vitalícia para nós atuarmos com o- absoluta e com distância (.) é o que eu costumo sempre dizer processo Não tem capa processo tem conteúdo tem articulação tem causas de pedir que são examinadas pelo Supremo presente apenas um figurino legal (.) Julga os colegas (?) Por mim você que acompanha a minha vida profissional algum tempo você acha que eu sou uma pessoa com- guardada (?) acho que não (..).,porque a cadeira ocupada por um juízo Supremo é uma cadeira vitalícia d- vitalícia para nós atuarmos com o- absoluta e com distância é o que eu costumo sempre dizer processo Não tem capa processo tem conteúdo tem articulação tem causas de pedir que são examinadas pelo Supremo presente apenas um figurino legal Julga os colegas (?) Por mim você que acompanha a minha vida profissional algum tempo você acha que eu sou uma pessoa com- guardada (?) acho que não .,50,21.77734375,28.90625,28.22265625,21.09375
15,Marco Aurelio,Augusto Nunes,mas seus colegas talvez não (?).,mas seus colegas talvez não (?).,100,0.3570556640625,0.3570556640625,99.6429443359375,99.6429443359375
16,Marco Aurelio,Marco Aurélio Mello,de forma alguma ao contrário eles atuam com desprendimento e só se curvam a ciência e consciência possuída nada mais (..).,de forma alguma ao contrário eles atuam com desprendimento e só se curvam a ciência e consciência possuída nada mais .,90,61.71875,58.984375,28.28125,31.015625
17,Marco Aurelio,André Guilherme Vieira,André Ministro boa noite tudo bem (?) aproveitando o gancho do Camilo falou a gente quem ouviu as escutas telefônicas da operação aleteia que envolvem o ex-presidente Lula mostram do começo ao fim do começo das capitações até o final delas uma preocupação do Lula e de outros interlocutores inclusive o ministro Jaques Wagner no sentido de que ele tava no foco do juiz Sérgio moro né (?). perguntou se o senhor Fazer uma comparação já que falamos aqui de um Supremo leniente essa questão da justiça na operação castelo de areia em que se apurou algo muito parecido numa escala muito menor que era a doações e listas de no caso envolvia aquela Empreiteira Camargo Corrêa a prova acabou toda a nula porque tem dado momento uma ministra uma ministra da- do STJ entendeu que por uma questão formal havia um vício de origem né a informação tinha chegado por uma denúncia anônima Então se cairia toda a operação a operação ru- ruim tá acontecendo algo parecido é guardadas as proporções na lava jato. perguntou o seguinte coloca assim na balança o que que é mais grave o que que é mais grave esse erro é- ser irregularidade cometida pelo morro ou uma diatribe ali documentada em áudio de pessoas que integram os quadros da República tramando para tentar deixar o ex-presidente livre da ação da persecução criminal (?) como é que será avalia isso (?).,André Ministro boa noite tudo bem (?) aproveitando o gancho do Camilo falou a gente quem ouviu as escutas telefônicas da operação aleteia que envolvem o ex-presidente Lula mostram do começo ao fim do começo das capitações até o final delas uma preocupação do Lula e de outros interlocutores inclusive o ministro Jaques Wagner no sentido de que ele tava no foco do juiz Sérgio moro né (?). perguntou se o senhor Fazer uma comparação já que falamos aqui de um Supremo leniente essa questão da justiça na operação castelo de areia em que se apurou algo muito parecido numa escala muito menor que era a doações e listas de no caso envolvia aquela Empreiteira Camargo Corrêa a prova acabou toda a nula porque tem dado momento uma ministra uma ministra da- do STJ entendeu que por uma questão formal havia um vício de origem né a informação tinha chegado por uma denúncia anônima Então se cairia toda a operação a operação ru- ruim tá acontecendo algo parecido é guardadas as proporções na lava jato. perguntou o seguinte coloca assim na balança o que que é mais grave o que que é mais grave esse erro é- ser irregularidade cometida pelo morro ou uma diatribe ali documentada em áudio de pessoas que integram os quadros da República tramando para tentar deixar o ex-presidente livre da ação da persecução criminal (?) como é que será avalia isso (?).,60,49.0234375,49.0234375,10.9765625,10.9765625
18,Marco Aurelio,Marco Aurélio Mello,não ele não ficaria se ocupasse uma cadeira no Ministério da Esplanada ele não ficaria livre da persecução criminal (.) ele evidentemente teria esse fórum que se diz como privilegiado ou seja ele teria o direito de ser julgado pelo Supremo. agora eu não entendo como se possa imaginar um tribunal de volante mas é mais lento (.) temos no país apenas um juiz novo juiz Sérgio Moro tem prestado grandes serviços a nação mas nós temos milhares de também é- quantistantes e severos na observância da legislação.,não ele não ficaria se ocupasse uma cadeira no Ministério da Esplanada ele não ficaria livre da persecução criminal ele evidentemente teria esse fórum que se diz como privilegiado ou seja ele teria o direito de ser julgado pelo Supremo. agora eu não entendo como se possa imaginar um tribunal de volante mas é mais lento temos no país apenas um juiz novo juiz Sérgio Moro tem prestado grandes serviços a nação mas nós temos milhares de também é- quantistantes e severos na observância da legislação.,90,21.97265625,19.921875,68.02734375,70.078125
19,Marco Aurelio,André Guilherme Vieira,do supremo tá convertido numa espécie de câmara criminal não é atribuição constitucional da corte né atribuição é justamente do primeiro grau então-.,do supremo tá convertido numa espécie de câmara criminal não é atribuição constitucional da corte né atribuição é justamente do primeiro grau então-.,100,40.4296875,40.4296875,59.5703125,59.5703125
