ID,ENTREVISTA,LOCUTOR,FALA_FIEL,FALA_HIGIENIZADA,NOTA_HUMANA,CONFIANCA_IA_FIEL,CONFIANCA_IA_HIGIENIZADA,ECE_FIEL,ECE_HIGIENIZADA
100,Marco Aurelio,André Guilherme Vieira,fazendo aqui um um uma interpretação do que o senhor falou (.) o Lula assumindo a Casa Civil a gente descendo de lado a hipótese dele ter assumido também para salvar Guardado na atuação da Primeira Instância que é mais rápida do que o Supremo existe aí um certo desvio de finalidade também num Ministro entrar no na Casa Civil para conduzir um governo que está praticamente do ponto de vista político morto (?),fazendo aqui um um uma interpretação do que o senhor falou o Lula assumindo a Casa Civil a gente descendo de lado a hipótese dele ter assumido também para salvar Guardado na atuação da Primeira Instância que é mais rápida do que o Supremo existe aí um certo desvio de finalidade também num Ministro entrar no na Casa Civil para conduzir um governo que está praticamente do ponto de vista político morto (?),95,46.2890625,40.234375,48.7109375,54.765625
101,Marco Aurelio,Marco Aurélio Mello,não há no ministério não porque ele será um auxiliar da presidência da república e ela de início cabe a escolha dos auxiliares cujos nomes não estão sujeitos sequer a aprovação do senado da República ao contrário do que ocorre em relação aos ocupantes de outros cargos (.) eu não vejo nada demais (.) agora o que eu não posso presumir ou excepcional que ele tenha buscado apenas como escudo né a nomeação para não ficar sob a jurisdição do juiz Sérgio moro (.) a nomeação para o ministério o objetivo maior penso não foi esse (..),não há no ministério não porque ele será um auxiliar da presidência da república e ela de início cabe a escolha dos auxiliares cujos nomes não estão sujeitos sequer a aprovação do senado da República ao contrário do que ocorre em relação aos ocupantes de outros cargos eu não vejo nada demais agora o que eu não posso presumir ou excepcional que ele tenha buscado apenas como escudo né a nomeação para não ficar sob a jurisdição do juiz Sérgio moro a nomeação para o ministério o objetivo maior penso não foi esse,75,24.12109375,49.609375,50.87890625,25.390625
102,Marco Aurelio,José Nêumanne,antes de passar para Maria Cristina eu queria dizer o seguinte (.) o ex-presidente Lula não se comporta como um subordinado da presidente Dilma as gravações isso Ficou claro na gravação do telefone (.) chora acha mesmo que o Lula não será o presidente de fato (?),antes de passar para Maria Cristina eu queria dizer o seguinte o ex-presidente Lula não se comporta como um subordinado da presidente Dilma as gravações isso Ficou claro na gravação do telefone chora acha mesmo que o Lula não será o presidente de fato (?),80,52.734375,46.2890625,27.265625,33.7109375
103,Marco Aurelio,Marco Aurélio Mello,não (.) eu acho que não será pelo gênio da própria presidente da república e não se manifeste é justamente que ela é muito voluntariosa e que elas vezes não ouve sequer aqueles que a circundam em termos de assessoria (..),não eu acho que não será pelo gênio da própria presidente da república e não se manifeste é justamente que ela é muito voluntariosa e que elas vezes não ouve sequer aqueles que a circundam em termos de assessoria,85,14.6484375,31.8359375,70.3515625,53.1640625
104,Marco Aurelio,Maria Cristina Frias,Maria Cristina (.) qual a jurisprudência no Supremo para esse caso de um político que tenta escapar e manobrar para escolher um fórum determinado seja aí para ser jogado pelo próprio STF seja ser julgado em primeira instância (?) porque o Supremo teve decisões um pouco consonantes digamos assim (.),Maria Cristina qual a jurisprudência no Supremo para esse caso de um político que tenta escapar e manobrar para escolher um fórum determinado seja aí para ser jogado pelo próprio STF seja ser julgado em primeira instância (?) porque o Supremo teve decisões um pouco consonantes digamos assim,90,29.1015625,31.8359375,60.8984375,58.1640625
105,Marco Aurelio,Marco Aurélio Mello,toda razão no caso em que o Supremo viu na renúncia ao mandato de um ex-deputado Federal o dono renúncia uma fraude a jurisdição dele Supremo (.) um integrante do supremo ficou vencido porque nos cabe simplesmente constatar um fato e a renúncia é um ato de vontade quem depende para surtir efeitos daqui essência de quem quer que seja (.) mas a jurisprudência do supremo variado um pouco (.) no caso do Eduardo Azeredo não foi assim né meninas do Ronaldo Cunha Lima em relação lá ao nosso estado né Ministro a tendência não sei porque o colegiado é sempre uma caixa de surpresas (.) cada qual a tua de acordo com o convencimento feito sobre a matéria e é bom que assim seja o que é o colegiado somatório de forças distintas nós nos completamos mutuamente e a maioria porque é um órgão democrático por Excelência a maioria tem sempre razão (..),toda razão no caso em que o Supremo viu na renúncia ao mandato de um ex-deputado Federal o dono renúncia uma fraude a jurisdição dele Supremo um integrante do supremo ficou vencido porque nos cabe simplesmente constatar um fato e a renúncia é um ato de vontade quem depende para surtir efeitos daqui essência de quem quer que seja mas a jurisprudência do supremo variado um pouco no caso do Eduardo Azeredo não foi assim né meninas do Ronaldo Cunha Lima em relação lá ao nosso estado né Ministro a tendência não sei porque o colegiado é sempre uma caixa de surpresas cada qual a tua de acordo com o convencimento feito sobre a matéria e é bom que assim seja o que é o colegiado somatório de forças distintas nós nos completamos mutuamente e a maioria porque é um órgão democrático por Excelência a maioria tem sempre razão,60,58.59375,49.4140625,1.40625,10.5859375
106,Marco Aurelio,Augusto Nunes,tem um couro mais grosso é uma coisa absurda numa democracia acontecer isso (.) eu acho que o senhor e o Luiz foram vítimas de do pior porque foram envolvidas as filhas nesse nesse processo de tentativa de agressão (.) se considera um homem suficientemente vivido nesse tipo de combate para enfrentar isso (?) Qual foi a questão de filhas (?),tem um couro mais grosso é uma coisa absurda numa democracia acontecer isso eu acho que o senhor e o Luiz foram vítimas de do pior porque foram envolvidas as filhas nesse nesse processo de tentativa de agressão se considera um homem suficientemente vivido nesse tipo de combate para enfrentar isso (?) Qual foi a questão de filhas (?),90,37.3046875,24.0234375,52.6953125,65.9765625
107,Marco Aurelio,Marco Aurélio Mello,quando eu respondo por mim inicialmente minha filha não tem culpa de ser minha filha (.) filha de uma outra juíza aliás muito respeitado (.) nem por isso ela poderia ser apelada (.) ela teve uma trajetória na advocacia ela optou pelo voto de pobreza porque sofreu um de excesso remuneratório né (?) E tem uma carga de serviço muito maior (.) ela estava em um escritório há 14 anos e um escritório que é um escritório mas eu vou fazer aqui propaganda (.),quando eu respondo por mim inicialmente minha filha não tem culpa de ser minha filha filha de uma outra juíza aliás muito respeitado nem por isso ela poderia ser apelada ela teve uma trajetória na advocacia ela optou pelo voto de pobreza porque sofreu um de excesso remuneratório né (?) E tem uma carga de serviço muito maior ela estava em um escritório há 14 anos e um escritório que é um escritório mas eu vou fazer aqui propaganda,75,34.375,31.640625,40.625,43.359375
108,Marco Aurelio,Augusto Nunes,esse tipo de esse tipo de evento isso o o incomoda uma cor-,esse tipo de esse tipo de evento isso o o incomoda uma cor-,90,11.81640625,11.81640625,78.18359375,78.18359375
109,Marco Aurelio,Marco Aurélio Mello,de forma alguma de forma alguma (.) se me incomodasse o descontentamento desta ou daquela facção desta daquela parte eu não estaria até hoje envergando a capa de Juiz (.) eu alcancei tempo para aposentadoria aos 52 anos o que revela burrice do nosso sistema Previdenciário (..),de forma alguma de forma alguma se me incomodasse o descontentamento desta ou daquela facção desta daquela parte eu não estaria até hoje envergando a capa de Juiz eu alcancei tempo para aposentadoria aos 52 anos o que revela burrice do nosso sistema Previdenciário,80,55.46875,58.59375,24.53125,21.40625
110,Marco Aurelio,Murilo Ramos,Murilo (.) a gente tem visto nas ruas milhares de pessoas apoiando o juiz federal Sérgio moro pessoas estampando utilizando camisetas com a com a foto dele (.) Que fenômeno é esse (?) é Sede de Justiça (?) como é que o senhor enxerga isso em termos de valores (?) e toda vez que alguém cumprindo simplesmente o dever cumpre o juiz Sérgio moro e tantos outros juízes né aparece ele acende ao grau de herói da Pátria (.) o senhor traz um paralelo com o que aconteceu com o Ministro Joaquim Barbosa no episódio do mensalão (?) um Supremo Tribunal Federal e outro na primeira instância que é a Pedreira da magistratura (?),Murilo a gente tem visto nas ruas milhares de pessoas apoiando o juiz federal Sérgio moro pessoas estampando utilizando camisetas com a com a foto dele Que fenômeno é esse (?) é Sede de Justiça (?) como é que o senhor enxerga isso em termos de valores (?) e toda vez que alguém cumprindo simplesmente o dever cumpre o juiz Sérgio moro e tantos outros juízes né aparece ele acende ao grau de herói da Pátria o senhor traz um paralelo com o que aconteceu com o Ministro Joaquim Barbosa no episódio do mensalão (?) um Supremo Tribunal Federal e outro na primeira instância que é a Pedreira da magistratura (?),85,49.609375,43.359375,35.390625,41.640625
111,Marco Aurelio,Gisele Vitória,Ministro ééé hoje o New York Times traz na sua capa uma foto enorme da presidente Dilma e o título como o Brasil algo como o Brasil como a teia da corrupção amarrou o Brasil e a base da matéria é em cima da delação premiada do senador delcídio do Amaral (.) eu queria que o seu comentasse a sua avaliação sobre as denúncias feitas na delação premiada do senador delcídio (.),Ministro hoje o New York Times traz na sua capa uma foto enorme da presidente Dilma e o título como o Brasil algo como o Brasil como a teia da corrupção amarrou o Brasil e a base da matéria é em cima da delação premiada do senador delcídio do Amaral eu queria que o seu comentasse a sua avaliação sobre as denúncias feitas na delação premiada do senador delcídio,85,37.5,43.5546875,47.5,41.4453125
112,Marco Aurelio,Marco Aurélio Mello,Seríssimo mas até aqui simples denúncias porque continuamos com o princípio da não culpabilidade (.) nós precisamos aguardar os processos crime que serão instaurados serão propostos né e mediante as ações mediante a atuação do ministério público e o ministério público está atento ao dever que ele você acha que não haverá tempo quer dizer essas denúncias elas não vão como até agora elas não entraram no processo de impeachment quer dizer isso vai vai ficar assim como o senhor imagina (?) Mas eu penso que a delação pelo menos sob o ângulo da corrupção não teria envolvido diretamente a Presidente da República (.) eu não conheço o objeto da delação (.) ela deveria ter sido guardada ter sido envelopada para ver a publicidade que a tônica da administração pública né apenas após o recebimento da denúncia (.) agora nós vivemos tempos muito estranhos e não devemos levar o que quer que seja de cambulhada (.) precisamos observar o figurino legal porque vou repetir Rui Barbosa Fora da Lei não há salvação (..),Seríssimo mas até aqui simples denúncias porque continuamos com o princípio da não culpabilidade nós precisamos aguardar os processos crime que serão instaurados serão propostos né e mediante as ações mediante a atuação do ministério público e o ministério público está atento ao dever que ele você acha que não haverá tempo quer dizer essas denúncias elas não vão como até agora elas não entraram no processo de impeachment quer dizer isso vai vai ficar assim como o senhor imagina (?) Mas eu penso que a delação pelo menos sob o ângulo da corrupção não teria envolvido diretamente a Presidente da República eu não conheço o objeto da delação ela deveria ter sido guardada ter sido envelopada para ver a publicidade que a tônica da administração pública né apenas após o recebimento da denúncia agora nós vivemos tempos muito estranhos e não devemos levar o que quer que seja de cambulhada precisamos observar o figurino legal porque vou repetir Rui Barbosa Fora da Lei não há salvação,65,51.953125,58.203125,13.046875,6.796875
113,Marco Aurelio,José Nêumanne,o senhor eu queria que o senhor comentasse o instrumento da delação premiado professor é a favor e e e por quê (?) eu nunca vi tanto delação premiada (.),o senhor eu queria que o senhor comentasse o instrumento da delação premiado professor é a favor e e e por quê (?) eu nunca vi tanto delação premiada,95,16.30859375,40.234375,78.69140625,54.765625
114,Marco Aurelio,Marco Aurélio Mello,primeiro lugar delação premiada deve ser espontânea (.) eu não compreendo que alguém possa ser colocado no xilindró provisoriamente mantido nesse xilindró até chegar de lá são premiada (.) alguma coisa errada está vendo (.) só um minutinho (.),primeiro lugar delação premiada deve ser espontânea eu não compreendo que alguém possa ser colocado no xilindró provisoriamente mantido nesse xilindró até chegar de lá são premiada alguma coisa errada está vendo só um minutinho,80,29.1015625,16.30859375,50.8984375,63.69140625
115,Marco Aurelio,José Nêumanne,o senhor acha por exemplo que se eu for submetido algum tipo de pressão eu vou eu inventaria crimes esses crimes que eles são confessando não são reais (?),o senhor acha por exemplo que se eu for submetido algum tipo de pressão eu vou eu inventaria crimes esses crimes que eles são confessando não são reais (?),100,55.859375,55.859375,44.140625,44.140625
116,Marco Aurelio,Marco Aurélio Mello,não não eu não estou eu não estou pressupondo aí a invencionice dos delatórios ou melhor dizendo os colaboradores com os judiciário (.) o que eu não compreendo é que se prenda invertendo-se a ordem natural que direcionante o princípio da não culpabilidade apurar para selar da culpa prendessem execução da pena (.) o que eu não compreendo é que se prenda para fragilizar o ser humano e ele vir a delatar (.) vejo não vejo operação lava jato ela vai chorar científica está acontecendo (?) Será que ele tem essa periculosidade tão grande a colocar em risco a ordem pública (?) não seja pelo princípio da não culpabilidade (.) Ou vamos então alterar a Constituição da República (.) alguém não pode ser considerado culpado antes da decisão preclusa na via do recurso enquanto modificável a decisão mediante recurso tem sim o princípio da Não essa altura uma coisa errada existe eu não compreendo a esta altura essa é uma questão vencida que está provado o que aconteceu mas como seu próprio disse o maior esquema corrupto da história foi desmatado (.),não não eu não estou eu não estou pressupondo aí a invencionice dos delatórios ou melhor dizendo os colaboradores com os judiciário o que eu não compreendo é que se prenda invertendo-se a ordem natural que direcionante o princípio da não culpabilidade apurar para selar da culpa prendessem execução da pena o que eu não compreendo é que se prenda para fragilizar o ser humano e ele vir a delatar vejo não vejo operação lava jato ela vai chorar científica está acontecendo (?) Será que ele tem essa periculosidade tão grande a colocar em risco a ordem pública (?) não seja pelo princípio da não culpabilidade Ou vamos então alterar a Constituição da República alguém não pode ser considerado culpado antes da decisão preclusa na via do recurso enquanto modificável a decisão mediante recurso tem sim o princípio da Não essa altura uma coisa errada existe eu não compreendo a esta altura essa é uma questão vencida que está provado o que aconteceu mas como seu próprio disse o maior esquema corrupto da história foi desmatado,55,58.203125,58.203125,3.203125,3.203125
117,Marco Aurelio,Augusto Nunes,Augusto Nunes para que processo é que eu disse que as instituições estão funcionando e que a quadra é oficialira sinaliza dias melhores excesso em termos de corporação eu não poderia na minha vida de Juiz Estou como juiz há 37 anos vou para 38 anos agora em novembro e Marginal o número tão grande delações premiadas (.) alguma coisa errada de carro colaboradores do Judiciário mas também nunca houve um caso desse tamanho isso é uma coisa monumental vamos desse tamanho outra coisa é o seguinte e não tem corregedoria na justiça para produzir o juiz tá prevaricando o seu mesmo como Ministro não podia denunciar tudo é você deve estar com o senhor fala o ex-presidente Lula de que o judiciário está convardado (.),Augusto Nunes para que processo é que eu disse que as instituições estão funcionando e que a quadra é oficialira sinaliza dias melhores excesso em termos de corporação eu não poderia na minha vida de Juiz Estou como juiz há 37 anos vou para 38 anos agora em novembro e Marginal o número tão grande delações premiadas alguma coisa errada de carro colaboradores do Judiciário mas também nunca houve um caso desse tamanho isso é uma coisa monumental vamos desse tamanho outra coisa é o seguinte e não tem corregedoria na justiça para produzir o juiz tá prevaricando o seu mesmo como Ministro não podia denunciar tudo é você deve estar com o senhor fala o ex-presidente Lula de que o judiciário está convardado,80,40.0390625,26.5625,39.9609375,53.4375
118,Marco Aurelio,André Guilherme Vieira,André ele falou que o Supremo tá covardado que eu esteja agora eu penso que ele falou sobre abandonar a hipocrisia nós precisamos deixar em segundo plano A Assunção da postura politicamente correta principalmente nós julgadores assim eu queria voltar nesse ponto (.) eu só acho que o CNJ tá prevaricando uma vez que o senhor dá dá o juiz Sérgio moro tá abusando há um sistema e nós esperamos que esse sistema realmente funciona mas tem funcionado que nós temos alguns pecadilhos que precisam ser corrigidas sempre pena de retrocesso cultural (.),André ele falou que o Supremo tá covardado que eu esteja agora eu penso que ele falou sobre abandonar a hipocrisia nós precisamos deixar em segundo plano A Assunção da postura politicamente correta principalmente nós julgadores assim eu queria voltar nesse ponto eu só acho que o CNJ tá prevaricando uma vez que o senhor dá dá o juiz Sérgio moro tá abusando há um sistema e nós esperamos que esse sistema realmente funciona mas tem funcionado que nós temos alguns pecadilhos que precisam ser corrigidas sempre pena de retrocesso cultural,90,34.1796875,24.0234375,55.8203125,65.9765625
119,Marco Aurelio,Marco Aurélio Mello,6%. por exemplo Provisórias entra na cabeça de alguém que os presos provisórios nas penitenciárias né chegaram o patamar dos presos definitivos (?) não entra ante o princípio da não outra razão para isso mesmo colocada em segundo plano A grande massa carcerária não tem dinheiro para cuxar um advogado do que late que um presidente da Odebrecht tem as defensorias públicas a Constituição de 1988 previu o direito jurídicas confiáveis contratar um advogado sem prejuízo do sustento ou do sustento da família (.) eu não posso a priori dizer que todas as decisões dele a não ser que ele seja um Semideus estejam corretas afinadas com a lei (.) nós erramos erramos na arte de proceder no processo e na- as decisões dele estão sendo confirmadas pelos tribunais superiores (.) eu não sei eu acho que não é Deus do caramba com esse fato E aí não teremos mais recursos vamos ter menos ocupadíssimo com o destino da lava jato (.) bom pode ter um destino (.) se eu acho que os indícios de legalidade na lava jato pode ser contraproducente para eficiência acho que alguns erros acabam desqualificando outros pronunciamentos corretíssimos relativos a lava jato (.) por isso é que o nosso sistema prever o recurso e o recurso deve ser apreciado com absoluta e com distância (.) é como eu faria ser juiz revisional da causa (.) E como eu espero que também os colegas que estão no Regional Federal no Superior Tribunal de Justiça no Supremo na segunda turma-,6%. por exemplo Provisórias entra na cabeça de alguém que os presos provisórios nas penitenciárias né chegaram o patamar dos presos definitivos (?) não entra ante o princípio da não outra razão para isso mesmo colocada em segundo plano A grande massa carcerária não tem dinheiro para cuxar um advogado do que late que um presidente da Odebrecht tem as defensorias públicas a Constituição de 1988 previu o direito jurídicas confiáveis contratar um advogado sem prejuízo do sustento ou do sustento da família eu não posso a priori dizer que todas as decisões dele a não ser que ele seja um Semideus estejam corretas afinadas com a lei nós erramos erramos na arte de proceder no processo e na- as decisões dele estão sendo confirmadas pelos tribunais superiores eu não sei eu acho que não é Deus do caramba com esse fato E aí não teremos mais recursos vamos ter menos ocupadíssimo com o destino da lava jato bom pode ter um destino se eu acho que os indícios de legalidade na lava jato pode ser contraproducente para eficiência acho que alguns erros acabam desqualificando outros pronunciamentos corretíssimos relativos a lava jato por isso é que o nosso sistema prever o recurso e o recurso deve ser apreciado com absoluta e com distância é como eu faria ser juiz revisional da causa E como eu espero que também os colegas que estão no Regional Federal no Superior Tribunal de Justiça no Supremo na segunda turma-,40,28.515625,46.09375,11.484375,6.09375
120,Marco Aurelio,Augusto Nunes,até para mais uma pergunta eu queria saber se o senhor acha que a operação lava jato contribuiu para isso ou não (?),até para mais uma pergunta eu queria saber se o senhor acha que a operação lava jato contribuiu para isso ou não (?),100,14.6484375,14.6484375,85.3515625,85.3515625
121,Marco Aurelio,Marco Aurélio Mello,Sem dúvida alguma o funcionamento das instituições (.) os meus aplausos para a Polícia Federal para o ministério público e também para magistratura simbolizada aí pelo juiz Sérgio moro (.),Sem dúvida alguma o funcionamento das instituições os meus aplausos para a Polícia Federal para o ministério público e também para magistratura simbolizada aí pelo juiz Sérgio moro,90,77.34375,75.0,12.65625,15.0
122,Marco Aurelio,Augusto Nunes,dá tempo para a última (.) Ah você tá ansiosa para fazer uma pergunta não tinha tido oportunidade de fazer mas era sobre essa essa fogueira de intolerância que a gente vive essa essa versão ao debate as redes sociais explodindo (.) Inclusive acho que o próprio o que eu pergunto no caso o senhor vê a gente vem inclusive riscos olhando assim ministros do Supremo sendo vistos como partidários algumas alguns comentários inclusive por favor eu quero saber como é que o Senhor responde a esse tipo de crítica por exemplo que o senhor tá defendendo um governo corrupto ou com- se o senhor converteu ao petismo o que que o senhor como é que o senhor olha isso (?),dá tempo para a última Ah você tá ansiosa para fazer uma pergunta não tinha tido oportunidade de fazer mas era sobre essa essa fogueira de intolerância que a gente vive essa essa versão ao debate as redes sociais explodindo Inclusive acho que o próprio o que eu pergunto no caso o senhor vê a gente vem inclusive riscos olhando assim ministros do Supremo sendo vistos como partidários algumas alguns comentários inclusive por favor eu quero saber como é que o Senhor responde a esse tipo de crítica por exemplo que o senhor tá defendendo um governo corrupto ou com- se o senhor converteu ao petismo o que que o senhor como é que o senhor olha isso (?),80,64.453125,67.1875,15.546875,12.8125
